Company Name,Date,Title,Description,Sentiment Score,Sentiment,URL
BEL,2025-03-04T17:00:00Z,Reporting on acquisition of treasury shares,"Regulated information  Aalst, Belgium, March 4, 2025 – In accordance with article 8:4 of the Royal Decree of April 2, 2019 executing the Belgian Code...",0.4588,Positive,https://www.globenewswire.com/news-release/2025/03/04/3036793/0/en/Reporting-on-acquisition-of-treasury-shares.html
BEL,2025-03-04T16:40:12Z,These Are the 3 Best Will Smith Sci-fi Movies,"Will Smith in I Am Legend.
Will Smith‘s impressive science fiction movie catalog has cemented the actor as an icon of the genre. Originally best known as the lead of the classic sitcom The Fresh Prince of Bel-Air, Will Smith has since made a name for himself …",0.9744,Positive,http://comicbook.com/movies/news/will-smith-best-sci-fi-movies-men-in-black-i-am-legend/
BEL,2025-03-04T15:12:48Z,textToKnowledgeGraph 0.2.7,A Python package to generate BEL statements and CX2 networks.,0.3182,Positive,https://pypi.org/project/texttoknowledgegraph/0.2.7/
BEL,2025-03-04T14:05:03Z,"FULL LIST: Arsenal face PSV in Champions League round of 16, Madrid host Atletico",Arsenal will take on Dutch club PSV Eindhoven in the first leg of the UEFA Champions League round of 16 as they look to bounce back from two consecutive winless games. The Gunners’ hopes of winning their first league title in 21 years seem to be fading after …,0.9628,Positive,https://punchng.com/full-list-arsenal-face-psv-in-champions-league-round-of-16-madrid-host-atletico/
BEL,2025-03-04T13:33:01Z,textToKnowledgeGraph 0.2.6,A Python package to generate BEL statements and CX2 networks.,0.3182,Positive,https://pypi.org/project/texttoknowledgegraph/0.2.6/
BEL,2025-03-04T10:01:00Z,All about Will Smith’s idyllic $42 million Calabasas mansion he built with Jada Pinkett Smith,Actor Will Smith has again waded into the center of controversy after putting on a very intimate performance with singer India Martínez.,-0.7096,Negative,https://www.marketwatch.com/story/all-about-will-smiths-idyllic-42-million-calabasas-mansion-he-built-with-jada-pinkett-smith-70c70f87
BEL,2025-03-04T09:30:00Z,"Global Processed Cheese Market to Hit USD 24,443.3 million by 2035, Growing at 3.3% CAGR | Future Market Insights, Inc.","The Processed Cheese Market growth is driven by rising consumer demand for convenience foods, expanding fast-food chains, and innovations in cheese processing technology. Increasing urbanization and evolving dietary preferences further support market expansio…",0.8126,Positive,https://www.globenewswire.com/news-release/2025/03/04/3036232/0/en/Global-Processed-Cheese-Market-to-Hit-USD-24-443-3-million-by-2035-Growing-at-3-3-CAGR-Future-Market-Insights-Inc.html
BEL,2025-03-04T07:56:44Z,"Top gainers & losers intraday March 4, 2025: SBI lead gains, auto stocks drag","Top gainers & losers intraday 4th Mar 2025: Bajaj Auto, Gensol Engineering, IGIL and Wendt among stocks that hit 52-week low",0.5106,Positive,https://www.thehindubusinessline.com/markets/stock-markets/top-gainers-losers-intraday-march-4-2025-sbi-lead-gains-auto-stocks-drag/article69289087.ece
BEL,2025-03-04T07:46:42Z,Defence mutual funds back in focus as European military spending expectations rise,"Over the weekend, leaders from major European economies agreed to increase defense spending, aiming to bolster the continent's ability to protect itself amid uncertainty over US NATO commitments.",0.9169,Positive,https://m.economictimes.com/mf/analysis/defence-mutual-funds-back-in-focus-as-european-military-spending-expectations-rise/articleshow/118703247.cms
BEL,2025-03-04T07:29:55Z,"Midday updates: Benchmark indices partially recover amid banking gains, global trade concerns persist","Concerns over U.S. tariffs and weak crude oil prices continued to loom over market sentiment, even as domestic institutional buying offered some support amid foreign institutional selling.",-0.6908,Negative,https://www.thehindubusinessline.com/markets/stock-markets/midday-updates-benchmark-indices-partially-recover-amid-banking-gains-global-trade-concerns-persist/article69289044.ece
BEL,2025-03-04T04:41:29Z,"US tariffs trigger global market volatility, indices open lower","The benchmark Sensex opened lower at 72,817.34 compared to its previous close of 73,085.94 and is currently trading at 72,837.38, down by 248.56 points or 0.34 per cent",-0.8779,Negative,https://www.thehindubusinessline.com/markets/stock-markets/us-tariffs-trigger-global-market-volatility-indices-open-lower/article69288494.ece
BEL,2025-03-04T04:41:29Z,"US tariffs trigger global market volatility, indices open lower","The benchmark Sensex opened lower at 72,817.34 compared to its previous close of 73,085.94 and is currently trading at 72,837.38, down by 248.56 points or 0.34 per cent",-0.8779,Negative,https://www.thehindubusinessline.com/markets/us-tariffs-trigger-global-market-volatility-indices-open-lower/article69288494.ece
BEL,2025-03-04T04:10:56Z,"京都のショコラ専門店が期間限定で伊勢丹新宿店にやってくる！""瑞穂のしずく""や""彩ショコラ""などの看板ショコラや焼菓子を揃え「ベルアメール 京都別邸」のポップアップストアがオープン。","[ジェイ・ワークス株式会社]
[画像1: https://prcdn.freetls.fastly.net/release_image/36932/381/36932-381-167e0d2032156fdacd88d10d1965988e-2500x1667.jpg?width=536&quality=85%2C75&format=jpeg&auto=webp&fit=bounds&...",0.0,Neutral,https://prtimes.jp/main/html/rd/p/000000381.000036932.html
BEL,2025-03-04T03:45:55Z,"Stocks to buy or sell today: UPL, BEL among top 10 trading ideas for 4 March, 2025","The Indian market is expected to open lower on Tuesday, following weak global cues. The Nifty futures closed with slight losses, and options data suggests a broader trading range between 21,700 and 22,700 zones. Experts recommend stocks like BEL, JSW Energy, …",-0.3182,Negative,https://economictimes.indiatimes.com/markets/stocks/news/stocks-to-buy-or-sell-today-upl-bel-among-top-10-trading-ideas-for-4-march-2025/articleshow/118697124.cms
BEL,2025-03-04T03:15:00Z,2 defence stocks to buy now; prefers these 2 PSBs before largecap private banks: Chakri Lokapriya,Chakri Lokapriya highlights opportunities in the defence sector due to increased European defence budgets and recommends Bharat Electronics and Hindustan Aeronautics. He sees potential in UltraTech and Ambuja in the cement sector and suggests investing in PSU…,0.7906,Positive,https://economictimes.indiatimes.com/markets/expert-view/2-defence-stocks-to-buy-now-prefers-these-2-psbs-before-largecap-private-banks-chakri-lokapriya/articleshow/118686211.cms
BEL,2025-03-03T23:52:06Z,Moto News | GNCC | ProMX | Enduro | MXGP | SX,"Moto News Weekly Wrap March 4, 2025 What’s New: Honda returns as with Penrite ProMX broadcast partner in 2025 2025 FIM Hard Enduro World Championship a victim of KTM financial woes 2025 Wild Boar GNCC Motorcycle Race Report Vince Friese crowned AMA Arenacross…",-0.4404,Negative,https://www.mcnews.com.au/moto-news-gncc-promx-enduro-mxgp-sx/
BEL,2025-03-03T23:15:10Z,1957 Chevrolet Bel Air,"This 1957 Chevrolet Bel Air two-door hardtop was refurbished under previous ownership and is powered by a 283ci Turbo-Fire V8 paired with a two-speed automatic transmission. The car is refinished in black over red and black upholstery and equipped with 14"" st…",0.0,Neutral,https://bringatrailer.com/listing/1957-chevrolet-bel-air-229/
BEL,2025-03-03T22:24:02Z,The Voice Season 27 Battle Advisors Have Been Revealed,"Season 27 of The Voice is heading toward the Battles round on NBC, and we’ve got the details on all the celebrity artists who’ll be joining Coaches Michael Bublé, Kelsea Ballerini, Adam Levine, and John Legend as this season’s Battle Advisors.",-0.9001,Negative,https://www.nbc.com/nbc-insider/the-voice-season-27-battle-advisors-revealed
BEL,2025-03-03T19:12:13Z,Another Murder Mystery Series - BBC's 'Towards Zero' Official Trailer,"""Someone, somewhere, unbeknownst to us, laying a trap..."" ""What have you done?!"" BBC & BritBox have revealed official trailers for the new murder mystery mini-series titled Towards Zero, created by BBC for streaming on BBC's iPlayer. It just launched this wee…",-0.9387,Negative,https://www.firstshowing.net/2025/another-murder-mystery-series-bbcs-towards-zero-official-trailer/
BEL,2025-03-03T19:05:34Z,The Exact Pre-Glam Facial That Prepped Oscar-Winner Zoe Saldana,Here is how celebrity facialist used The Method and Augustinus Bader skincare for Oscar Winner Zoe Saldana's pre-glam facial at the Academy Awards.,0.9565,Positive,https://www.forbes.com/sites/jessicaourisman/2025/03/03/the-exact-pre-glam-facial-that-prepped-oscar-winner-zoe-saldana/
BEL,2025-03-03T17:30:00Z,EVS Broadcast Equipment reports update of share buyback program,"Publication on March 3 2025 at 18:30 CET after market closingRegulated information EVS Broadcast Equipment SA: Euronext Brussels (EVS.BR), Bloomberg (EVS BB), Reuters (EVSB.BR)",0.296,Positive,https://www.globenewswire.com/news-release/2025/03/03/3035885/0/en/EVS-Broadcast-Equipment-reports-update-of-share-buyback-program.html
BEL,2025-03-03T14:31:27Z,"Market Trading Guide: BEL, Bajaj Finance among 5 stock recommendations for Tuesday","Indian headline indices conceded their morning gains dragged by bank and financial stocks to end Monday in the red. Nifty fell for the ninth straight session while BSE Sensex recorded its second consecutive loss today. The 50-stock index finished at 22,119.30…",0.8519,Positive,https://m.economictimes.com/markets/stocks/news/market-trading-guide-bel-bajaj-finance-among-5-stock-recommendations-for-tuesday/stock-ideas/slideshow/118687990.cms
BEL,2025-03-03T14:00:00Z,Post-processing and weighted combination of infectious disease nowcasts,"Author summary Infectious disease surveillance data are often subject to reporting delays, which cause recent data points to be incomplete. This leads to spurious dips towards the end of incidence time series, and hampers the real-time assessment of trends. S…",-0.1027,Negative,https://journals.plos.org/ploscompbiol/article?id=10.1371/journal.pcbi.1012836
BEL,2025-03-03T10:21:00Z,"2025 Premiere Dates For New & Returning Series On Broadcast, Cable & Streaming","Welcome to Deadline’s annual list of premiere dates for new and returning TV series. The roster covers hundreds of broadcast, cable and streaming programs debuting throughout 2025, including many still listed as TBA (to be announced). It includes series premi…",0.7184,Positive,http://deadline.com/2025/03/2025-tv-premiere-dates-1235811038/
BEL,2025-03-03T08:01:34Z,EUROTRASH Monday: Pogačar Roubaix Rumours and the Opening Weekend Classics,"Mar 3, 2025: The season proper has started with the Omloop, Kuurne, O Gran Camiño, Ardèche Classic and Drôme Classic - All the reports, results, rider quotes and video. TOP STORY: Will World champion, Tadej Pogačar, ride Paris-Roubaix this year? More rumours.…",0.7531,Positive,https://pezcyclingnews.com/eurotrash/eurotrash-cycling-news-monday-3-2-2025-pogacar-roubaix-omloop-kuurne-grancamino-ardeche-drome-groves-vanaert-frison-lefevere-boonen-terpstra-ineos-intermarche-wanty-tour-giro-vuelta-strade-bianche-san/
BEL,2025-03-03T07:51:43Z,"Top gainers & losers Intraday March 3, 2025: IT, auto stocks show resilience amid market volatility","Top gainers of Nifty 50 include Bharat Electronics, UltraTech Cement, Grasim Industries, Eicher Motors, and Wipro; market remains volatile.",0.7003,Positive,https://www.thehindubusinessline.com/markets/stock-markets/top-gainers-losers-intraday-march-3-2025-it-auto-stocks-show-resilience-amid-market-volatility/article69284889.ece
BEL,2025-03-03T07:25:25Z,Markets slip further as selling intensifies; declines outnumber advances 5:1,"The BSE Sensex fell 189.19 points or 0.26 per cent to 73,008.91, while the NSE Nifty declined 48.15 points or 0.22 per cent to 22,076.55 as of 12.30 PM",-0.296,Negative,https://www.thehindubusinessline.com/markets/stock-markets/markets-slip-further-as-selling-intensifies-declines-outnumber-advances-51/article69284800.ece
BEL,2025-03-03T03:33:41Z,"Quincy Jones Gets Oscar Tribute From Oprah, Whoopi Goldberg and Queen Latifah: ‘When We Talk About Black Excellence, We’re Talking About Quincy’","Queen Latifah hit the stage at the 97th Academy Awards with a live performance, paying tribute to the late Quincy Jones through a performance of “Ease On Down the Road.” Jones died in November, and Latifah’s performance honored the Grammy-winning producer and…",0.7717,Positive,https://variety.com/2025/film/awards/quincy-jones-oscar-tribute-oprah-whoopi-goldberg-queen-latifah-1236322821/
BEL,2025-03-03T01:51:15Z,Renaux tops Febvre at MXGP opener in Argentina,"2025 FIM Motocross World Championship Round One – MXGP of Argentina Córdoba, Argentina held the opening round of the 2025 FIM Motocross World Championship, with the MXGP class witnessing an epic battle between Maxime Renaux and Romain Febvre, the Blue and Gre…",0.8555,Positive,https://www.mcnews.com.au/2025-mxgp-argentina-round-one-report-results/
BEL,2025-03-03T00:41:58Z,Premio Oscar: il via con Erivo e Ariana Grande. Kieran Culkin attore non protagonista,Conan O'Brien apre con gag horror. Scenetta ispirata a The Substance con Demi Moore (ANSA),-0.7269,Negative,https://www.ansa.it/sito/notizie/cultura/2025/03/03/premio-oscar-il-via-con-erivo-e-ariana-grande.-conan-obrien-apre_94842a42-90c2-4b2d-a212-5d9ea1dd871a.html
BEL,2025-03-03T00:30:00Z,The Real Story Behind the Entertainment Legend Quincy Jones,"WEST HOLLYWOOD, CALIFORNIA - OCTOBER 26: Quincy Jones attends the Dolemite Is My Name! LA AMPAS Hosted Tastemaker at San Vicente Bungalows on October 26, 2019 in West Hollywood, California.
Photo: Arnold Turner (Getty Images)
The world lost a legend on Nove…",0.4574,Positive,https://www.theroot.com/the-real-story-behind-the-entertainment-legend-quincy-j-1851767151
BEL,2025-03-03T00:25:45Z,Oversold Nifty may see a technical bounce: Analysts,"Stocks like HDFC Bank, Bajaj Finance, Hindalco, Ashok Leyland, NTPC, BEL, Chola Finance, JSW Energy, Narayana Hrudayalaya, and SBI Cards look promising on the charts, with potential returns of 5–8%, analysts said.",0.9022,Positive,https://economictimes.indiatimes.com/markets/stocks/news/oversold-nifty-may-see-a-technical-bounce-analysts/articleshow/118670843.cms
BEL,2025-03-02T18:22:06Z,"È la notte degli Oscar, l'Italia spera con Rossellini",Sfida Anora-Conclave-The Brutalist. Freeman omaggia Gene Hackman (ANSA),0.6249,Positive,https://www.ansa.it/sito/notizie/cultura/cinema/2025/03/02/e-la-notte-degli-oscar-litalia-spera-con-rossellini_5e9d5e20-caed-494b-88e8-a3918df187e1.html
BEL,2025-03-02T16:00:33Z,KUURNE-BRUSSEL-KUURNE’25: Jasper Jumps ’em!,"As expected, the 2025 Kuurne-Brussel-Kuurne came down to a bunch sprint. Fairly unsurprisingly, it was Jasper Philipsen who was perfectly piloted to the finish-line by his Alpecin-Deceuninck teammates to take the win. He soundly beat young Olav Kooij of Visma…",0.9259,Positive,https://pezcyclingnews.com/racing/kuurne-brussel-kuurne-2025-jasper-philipsen-jumps-em/
BEL,2025-03-01T21:00:00Z,How to Watch 2025 WWE Elimination Chamber: Toronto Live Online,"After a thrilling and dazzling Royal Rumble, WWE returns to “The Great White North” for WWE Elimination Chamber: Toronto, a premium live event on Saturday, Mar. 1. The event features two different “Elimination Chamber” matches where six wrestlers (six men in …",0.8834,Positive,https://variety.com/2025/shopping/news/how-to-watch-wwe-elimination-chamber-online-livestreaming-1236323574/
BEL,2025-03-01T20:39:22Z,"Blair Underwood, Cliff ‘Method Man’ Smith, J. Alphonse Nicholson & Omar J. Dorsey Receive Their Flowers At 2025 Lexus UPTOWN Honors Hollywood","Honorees Blair Underwood, Cliff ‘Method Man’ Smith, J. Alphonse Nicholson and Omar J. Dorsey shine at 2025 Lexus UPTOWN Honors Hollywood
The post Blair Underwood, Cliff ‘Method Man’ Smith, J. Alphonse Nicholson & Omar J. Dorsey Receive Their Flowers At 2025 L…",0.9648,Positive,http://bossip.com/2792474/method-man-blair-underwood-j-alphonse-nicholson-omar-j-dorsey-shine-2025-lexus-uptown-honors-hollywood/
BEL,2025-03-01T16:19:10Z,Show HN: Online Translators for Language Lovers,"Welcome to iLoveTranslate, your go-to destination for an array of fun and unique language translators. Explore a variety of free online language translators, including everything from a brainrot translator to a royal English translator and a Gen Alpha transla…",0.936,Positive,https://ilovetranslate.com
BEL,2025-03-01T15:00:37Z,OMLOOP HET NIEUWSBLAD’25: Søren Wærenskjold Sprints to Victory!,"The first 'real' race of the season, the Omloop Het Nieuwblad, surprisingly finished with a bunch sprint and in a close fought lunge for the line, it was Uno-X Mobility's Søren Wærenskjold who got the better of Paul Magnier (Soudal Quick-Step) and Jasper Phil…",0.4574,Positive,https://pezcyclingnews.com/racing/omloop-het-nieuwsblad-2025-soren-waerenskjold-sprints-to-victory/
BEL,2025-03-01T07:55:51Z,"Death Before Dishonor Premiere New Single & Music Video ""Overruled""","Death Before Dishonor have dropped their new single, Overruled, streaming via YouTube and Spotify for you now below. Accompanying the track’s release is an official music video, now available for viewing.





The band shared their thoughts on the song, stati…",-0.8834,Negative,http://www.metalunderground.com/news/details.cfm?newsid=159190
BEL,2025-03-01T01:01:27Z,FIA WEC: Strong season-opener for the BMW M Hybrid V8 – BMW M4 GT3 EVO scores podium at debut.,"At the season-opener of the FIA World Endurance Championship (FIA WEC) in Qatar, the BMW M Hybrid V8 and the BMW M4 GT3 EVO delivered strong performances, making a significant impact in the competition against the world&#039;s top manufacturers.",0.959,Positive,https://www.press.bmwgroup.com/global/article/detail/T0448440EN/fia-wec:-strong-season-opener-for-the-bmw-m-hybrid-v8-–-bmw-m4-gt3-evo-scores-podium-at-debut?language=en
BEL,2025-02-28T22:33:09Z,Coco Jones Is a Vision in Alevi Milano Strappy Sandals and Burgundy Ensemble at Macro’s 2025 Pre-Oscars Party,"Coco Jones was seen wearing strappy sandals from Alevi at Macro's Pre-Oscars party in Los Angeles, Calif.",0.8442,Positive,http://footwearnews.com/fashion/celebrity-style/coco-jones-alevi-milano-strappy-sandals-macro-oscars-party-1234776352/
BEL,2025-02-28T22:00:00Z,17 Hollywood Stars You Didn’t Know Voiced Anime Characters,"You know them for their work in Hollywood, but they've also lent their voices to some of the most popular anime series and films 
The post 17 Hollywood Stars You Didn’t Know Voiced Anime Characters appeared first on TheWrap.",0.8397,Positive,https://www.thewrap.com/celebrities-who-starred-in-anime-hollywood-english-dub/
BEL,2025-02-28T21:58:43Z,Maurice is an intimate look at Quebec's biggest hockey hero,The new documentary from Serge Giguère is a deeply personal film cut from 35 years of Maurice 'The Rocket' Richard footage and will be the closing night film of the Rendez-vous Québec Cinéma film festival.,0.6637,Positive,https://www.cbc.ca/arts/maurice-is-an-intimate-look-at-quebec-s-biggest-hockey-hero-1.7471905
BEL,2025-02-28T19:12:50Z,"DEFTONES To Celebrate Diamond Eyes, White Pony & Adrenaline At Louder Than Life 2025","All celebrating anniversaries this year.
The post DEFTONES To Celebrate Diamond Eyes, White Pony & Adrenaline At Louder Than Life 2025 appeared first on Metal Injection.",0.9828,Positive,https://metalinjection.net/news/deftones-to-celebrate-diamond-eyes-white-pony-adrenaline-at-louder-than-life-2025
BEL,2025-02-28T18:15:00Z,"A Bit of the Old Ultraviolence in Three Trailers: 'Havoc,' 'Another Simple Favor,' 'Fight or Flight'","Netflix's upcoming movie, Havoc, is the stuff violent, Pajiban dreams are made of. It's written and directed by Gareth Evans (The Raid, Gangs of London), and stars Tom Hardy, Jessie Mei Li (Shadow & Bone), Justin Cornwell (Bel-Air), Luis...
Read more...",-0.8555,Negative,https://www.pajiba.com/news/a-bit-of-the-old-ultraviolence-in-three-trailers-havoc-another-simple-favor-fight-or-flight.php
BEL,2025-02-28T15:16:02Z,R&Bs Coco Jones FINALLY Got A Man – NBAs Donoval Mitchell!,"After months of swirling rumors, Media Take Out confirmed that what fans have long suspected— Coco Jones is in a relationship with Cleveland Cavaliers star Donovan Mitchell. The Bel-Air actress and singer addressed the speculation while sitting down for a can…",-0.2942,Negative,https://mediatakeout.com/rbs-coco-jones-finally-got-a-man-nbas-donoval-mitchell/
BEL,2025-02-28T09:16:38Z,Dååth Tap Cynic’s Paul Masvidal For Cover Of Air’s “Run”,"Progressive death metal outfit Dååth have released their rendition of Run, originally by French electronic duo Air. This reimagined version features Cynic’s Paul Masvidal on vocals and guitar, with mixing handled by Igorrr mastermind Gautier Serre.






Dååt…",-0.8807,Negative,http://www.metalunderground.com/news/details.cfm?newsid=159189
BEL,2025-02-28T08:55:00Z,"Get The Shot Premiere New Single & Music Video ""Pit Of Misery""","Quebec City, QC hardcore outfit Get The Shot have unveiled a new video for Pit Of Misery, a track described in a press release as ‘their heaviest song ever.’ Check it out streaming via YouTube and Spotify for you now below.





Up next, the band will embark …",-0.9022,Negative,http://www.metalunderground.com/news/details.cfm?newsid=159186
BEL,2025-02-27T22:00:00Z,The 7 Most Heartbreaking Moments In Sitcom History,And we're still not over it.,0.818,Positive,https://thoughtcatalog.com/richard-chachowski/2025/02/the-7-most-heartbreaking-moments-in-sitcom-history/
BEL,2025-02-27T21:15:00Z,John Bel Edwards and Garret Graves join influential think tank as energy policy experts,"WASHINGTON – Former Louisiana Gov. John Bel Edwards and former Baton Rouge Congressman Garret Graves were named Thursday to the energy advisory council of an influential think tank, the Bipartisan Policy Center.",0.9246,Positive,https://www.theadvocate.com/baton_rouge/news/politics/john-bel-edwards-and-garret-graves-join-think-tank/article_25b0fae8-e9ff-53a8-b357-2c3968eb4390.html
BEL,2025-02-27T20:40:49Z,What to Watch for Black History Month and Beyond,"Here are some of the best movies and shows that highlight Black voices, history and talent.",0.8591,Positive,https://www.ign.com/articles/what-to-watch-february-black-history-month
BEL,2025-02-27T15:43:01Z,Cavalier Coupledom: Coco Jones Finally Breaks Her Silence On Long-Standing Donovan Mitchell Romance Rumors,"Coco Jones is finally giving fans what they want, addressing the ongoing rumors about her relationship status.
The post Cavalier Coupledom: Coco Jones Finally Breaks Her Silence On Long-Standing Donovan Mitchell Romance Rumors appeared first on Bossip.",0.9118,Positive,http://bossip.com/2789850/coco-jones-donovan-mitchell-romance-rumors/
BEL,2025-02-27T14:05:00Z,5 times Doechii broke the internet,"As rap’s newest number one graces the cover of our Spring 2025 issue, we look back at her most viral moments so far",0.4019,Positive,https://www.dazeddigital.com/music/article/66206/1/five-times-doechii-broke-the-internet-tiktok-tiny-desk-grammy-awards?utm_source=Link&utm_medium=Link&utm_campaign=RSSFeed&utm_term=5-times-doechii-broke-the-internet
BEL,2025-02-27T14:00:09Z,Batting Around: What would your walk-up song be if you were an MLB player?,Do you want your own personal hype song? A fan favorite? A crowd sing-along?,0.8677,Positive,https://www.cbssports.com/mlb/news/batting-around-what-would-your-walk-up-song-be-if-you-were-an-mlb-player/
BEL,2025-02-27T08:01:39Z,EUROTRASH Thursday: Omloop Up Next & Worlds Controversy,"Feb 26, 2025: As we get ready for the first Flemish races in the 'Opening Weekend', we have the first stage of the O Gran Camiño with video and race report. TOP STORY: European Parliament calls for cancellation of World champs in Rwanda. Rider news: Van Aert,…",0.8971,Positive,https://pezcyclingnews.com/eurotrash/eurotrash-cycling-news-thursday-27-2-2025-openingweekend-ocamino-rwanda-vanaert-visma-evenepoel-deplus-ineos-vingegaard-armstrong-bernal-canyon-uae-flanders-hetnieuwsblad-tour-giro-vuelta/
BEL,2025-02-27T05:01:28Z,City of Prince George applies to close court-protected homeless encampment,"The City of Prince George in north-central B.C. has applied to the courts in a bid to close a homeless encampment in the Moccasin Flats area, in what is the latest chapter in a long-running dispute.",-0.6597,Negative,https://www.cbc.ca/news/canada/british-columbia/moccasin-flats-encampment-closure-1.7469714
BEL,2025-02-26T22:38:59Z,Modified 1956 Chevrolet Bel Air Convertible,"This 1956 Chevrolet Bel Air convertible was refurbished and modified during a custom build under prior ownership that included the installation of a late-model Vortec V8 and a four-speed automatic transmission. The body was repainted in bronze and white, and …",0.0,Neutral,https://bringatrailer.com/listing/1956-chevrolet-bel-air-65/
BEL,2025-02-26T20:00:00Z,How to Watch All of the ‘Bridget Jones’ Movies Online,"Although “Bridget Jones: Mad About The Boy” is a straight-to-streaming film in the United States, the fourth movie in the series is actually a big office office hit in the rest of the world. if you’re looking to revisit the Bridget Jones universe following th…",-0.5574,Negative,https://variety.com/2025/shopping/news/how-to-watch-all-bridget-jones-movies-online-streaming-1236321074/
